{
  "schema_version": "1.0",
  "alias": "agent-vm/2026.10.0",
  "version": "2026.10.0",
  "immutable_tag": "agent-vm-2026.10.0+g68763f60ef6d",
  "gitsha": "68763f60ef6d",
  "image_digest": "sha256:3aeaab4d16fa",
  "artifacts": [
    {
      "name": "agent-vm-2026.10.0-68763f60ef6d.tar.gz",
      "format": "lxd-image",
      "size_bytes": 801808873,
      "sha256": "eb7806889646eb7b59bcd590b4d1ceae5c3b2ce211490426054e981381af12b1"
    }
  ],
  "pins": {
    "python": "3.12",
    "node_version": "20.20.2",
    "runtime": {
      "aiosqlite": "0.22.1",
      "annotated-doc": "0.0.5",
      "annotated-types": "0.8.0",
      "anyio": "4.15.1",
      "attrs": "26.1.0",
      "authlib": "1.8.0",
      "certifi": "2026.7.22",
      "cffi": "2.1.1",
      "charset-normalizer": "3.5.2",
      "click": "8.5.0",
      "cryptography": "50.0.2",
      "distro": "1.9.0",
      "fastapi": "0.141.1",
      "google-adk": "2.11.0",
      "google-auth": "2.59.1",
      "google-genai": "2.28.0",
      "graphviz": "0.21",
      "h11": "0.16.0",
      "httpcore": "1.0.9",
      "httpcore2": "2.13.1",
      "httpx": "0.28.1",
      "httpx2": "2.13.1",
      "idna": "3.20",
      "jiter": "0.17.0",
      "joserfc": "1.7.5",
      "jsonpatch": "1.33",
      "jsonpointer": "3.1.1",
      "jsonschema": "4.26.0",
      "jsonschema-specifications": "2025.9.1",
      "langchain-core": "1.6.6",
      "langchain-protocol": "0.0.19",
      "langgraph": "1.2.12",
      "langgraph-checkpoint": "4.2.0",
      "langgraph-prebuilt": "1.1.0",
      "langgraph-sdk": "0.4.5",
      "langsmith": "0.14.4",
      "openai": "3.24.0",
      "opentelemetry-api": "1.42.1",
      "opentelemetry-sdk": "1.42.1",
      "opentelemetry-semantic-conventions": "0.63b1",
      "orjson": "3.12.0",
      "ormsgpack": "1.12.2",
      "packaging": "26.3",
      "pyasn1": "0.6.4",
      "pyasn1-modules": "0.4.2",
      "pycparser": "3.0",
      "pydantic": "2.13.5",
      "pydantic-core": "2.46.5",
      "python-dotenv": "1.2.4",
      "python-multipart": "0.0.32",
      "pyyaml": "6.0.3",
      "referencing": "0.37.0",
      "requests": "2.34.2",
      "requests-toolbelt": "1.0.0",
      "rpds-py": "2026.6.3",
      "setuptools": "84.0.0",
      "sniffio": "1.3.1",
      "starlette": "1.7.0",
      "structlog": "26.1.0",
      "tenacity": "9.1.4",
      "truststore": "0.10.4",
      "typing-extensions": "4.16.0",
      "typing-inspection": "0.4.4",
      "urllib3": "2.8.0",
      "uuid-utils": "0.17.1",
      "uvicorn": "0.54.0",
      "watchdog": "6.0.0",
      "websockets": "15.0.1",
      "xxhash": "4.0.1",
      "zstandard": "0.25.0"
    },
    "frameworks": {
      "langchain": {
        "aiohappyeyeballs": "2.7.1",
        "aiohttp": "3.14.3",
        "aiosignal": "1.4.0",
        "annotated-types": "0.8.0",
        "anyio": "4.15.1",
        "attrs": "26.1.0",
        "certifi": "2026.7.22",
        "charset-normalizer": "3.5.2",
        "distro": "1.9.0",
        "frozenlist": "1.8.0",
        "h11": "0.16.0",
        "httpcore": "1.0.9",
        "httpcore2": "2.13.1",
        "httpx": "0.28.1",
        "httpx-sse": "0.4.3",
        "httpx2": "2.13.1",
        "idna": "3.20",
        "jsonpatch": "1.33",
        "jsonpointer": "3.1.1",
        "langchain": "1.4.3",
        "langchain-classic": "1.0.8",
        "langchain-community": "0.4.2",
        "langchain-core": "1.6.6",
        "langchain-protocol": "0.0.19",
        "langchain-text-splitters": "1.1.3",
        "langgraph": "1.2.12",
        "langgraph-checkpoint": "4.2.0",
        "langgraph-prebuilt": "1.1.0",
        "langgraph-sdk": "0.4.5",
        "langsmith": "0.14.4",
        "multidict": "6.9.1",
        "numpy": "2.5.3",
        "orjson": "3.12.0",
        "ormsgpack": "1.12.2",
        "packaging": "26.3",
        "propcache": "0.5.4",
        "pydantic": "2.13.5",
        "pydantic-core": "2.46.5",
        "pydantic-settings": "2.15.0",
        "python-dotenv": "1.2.4",
        "pyyaml": "6.0.3",
        "requests": "2.34.2",
        "requests-toolbelt": "1.0.0",
        "sniffio": "1.3.1",
        "sqlalchemy": "2.1.3",
        "tenacity": "9.1.4",
        "truststore": "0.10.4",
        "typing-extensions": "4.16.0",
        "typing-inspection": "0.4.4",
        "urllib3": "2.8.0",
        "uuid-utils": "0.17.1",
        "websockets": "16.1.1",
        "xxhash": "4.0.1",
        "yarl": "1.25.1",
        "zstandard": "0.25.0"
      },
      "crewai": {
        "aiofiles": "24.1.0",
        "aiohappyeyeballs": "2.7.1",
        "aiohttp": "3.14.3",
        "aiosignal": "1.4.0",
        "aiosqlite": "0.21.0",
        "annotated-doc": "0.0.5",
        "annotated-types": "0.8.0",
        "anyio": "4.15.1",
        "appdirs": "1.4.4",
        "attrs": "26.1.0",
        "backoff": "2.2.1",
        "bcrypt": "5.0.0",
        "build": "1.6.1",
        "cel-python": "0.5.0",
        "certifi": "2026.7.22",
        "cffi": "2.1.1",
        "charset-normalizer": "3.5.2",
        "chromadb": "1.1.1",
        "click": "8.5.0",
        "crewai": "1.15.23",
        "crewai-cli": "1.15.23",
        "crewai-core": "1.15.23",
        "cryptography": "50.0.2",
        "deprecation": "2.1.0",
        "distro": "1.9.0",
        "docstring-parser": "0.18.0",
        "durationpy": "0.11",
        "et-xmlfile": "2.0.0",
        "filelock": "4.0.10",
        "flatbuffers": "25.12.19",
        "frozenlist": "1.8.0",
        "fsspec": "2026.9.0",
        "google-re2": "1.1.20251105",
        "googleapis-common-protos": "1.75.5",
        "grpcio": "1.84.0",
        "h11": "0.16.0",
        "hf-xet": "1.6.0",
        "httpcore": "1.0.9",
        "httptools": "0.8.0",
        "httpx": "0.28.1",
        "httpx-sse": "0.4.3",
        "huggingface-hub": "1.33.0",
        "idna": "3.20",
        "importlib-resources": "7.1.0",
        "instructor": "1.15.4",
        "jinja2": "3.1.6",
        "jiter": "0.14.0",
        "jmespath": "1.1.0",
        "json-repair": "0.60.1",
        "json5": "0.10.0",
        "jsonref": "1.1.0",
        "jsonschema": "4.26.0",
        "jsonschema-specifications": "2025.9.1",
        "kubernetes": "36.0.3",
        "lance-namespace": "0.13.0",
        "lance-namespace-urllib3-client": "0.13.0",
        "lancedb": "0.30.0",
        "lark": "1.3.1",
        "linkify-it-py": "2.2.0",
        "markdown-it-py": "4.2.0",
        "markupsafe": "3.0.4",
        "mcp": "1.28.1",
        "mdit-py-plugins": "0.6.1",
        "mdurl": "0.1.2",
        "mmh3": "5.3.1",
        "multidict": "6.9.1",
        "numpy": "2.5.3",
        "oauthlib": "4.0.0",
        "onnxruntime": "1.30.0",
        "openai": "2.54.0",
        "openpyxl": "3.1.5",
        "opentelemetry-api": "1.45.0",
        "opentelemetry-exporter-http-transport": "0.66b0",
        "opentelemetry-exporter-otlp-common": "0.66b0",
        "opentelemetry-exporter-otlp-proto-common": "1.45.0",
        "opentelemetry-exporter-otlp-proto-grpc": "1.45.0",
        "opentelemetry-exporter-otlp-proto-http": "1.45.0",
        "opentelemetry-proto": "1.45.0",
        "opentelemetry-sdk": "1.45.0",
        "opentelemetry-semantic-conventions": "0.66b0",
        "orjson": "3.12.0",
        "overrides": "7.7.0",
        "packaging": "26.3",
        "pdfminer-six": "20260107",
        "pdfplumber": "0.11.10",
        "pendulum": "3.2.0",
        "pillow": "12.3.0",
        "platformdirs": "4.12.3",
        "portalocker": "2.7.0",
        "posthog": "5.4.0",
        "propcache": "0.5.4",
        "protobuf": "7.36.2",
        "pyarrow": "25.0.1",
        "pybase64": "1.5.0",
        "pycparser": "3.0",
        "pydantic": "2.12.5",
        "pydantic-core": "2.41.5",
        "pydantic-settings": "2.15.0",
        "pygments": "2.21.0",
        "pyjwt": "2.15.1",
        "pypdfium2": "5.13.0",
        "pypika": "0.51.1",
        "pyproject-hooks": "1.3.3",
        "python-dateutil": "2.9.0.post0",
        "python-dotenv": "1.2.4",
        "python-multipart": "0.0.32",
        "pyyaml": "6.0.3",
        "referencing": "0.37.0",
        "regex": "2026.1.15",
        "requests": "2.34.2",
        "requests-oauthlib": "2.0.0",
        "rich": "14.3.4",
        "rpds-py": "2026.6.3",
        "shellingham": "1.5.4",
        "six": "1.17.0",
        "sniffio": "1.3.1",
        "sse-starlette": "3.5.0",
        "starlette": "1.7.0",
        "tenacity": "9.1.4",
        "textual": "8.2.8",
        "tokenizers": "0.23.2",
        "tomli": "2.0.2",
        "tomli-w": "1.1.0",
        "tqdm": "4.70.1",
        "typer": "0.27.2",
        "typing-extensions": "4.16.0",
        "typing-inspection": "0.4.4",
        "tzdata": "2026.5",
        "urllib3": "2.8.0",
        "uv": "0.11.33",
        "uvicorn": "0.54.0",
        "uvloop": "0.23.0",
        "watchfiles": "1.3.0",
        "websocket-client": "1.9.2",
        "websockets": "17.2",
        "yarl": "1.25.1"
      },
      "autogen": {
        "annotated-types": "0.8.0",
        "autogen-agentchat": "0.7.5",
        "autogen-core": "0.7.5",
        "jsonref": "1.1.0",
        "opentelemetry-api": "1.45.0",
        "pillow": "12.3.0",
        "protobuf": "5.29.6",
        "pydantic": "2.13.5",
        "pydantic-core": "2.46.5",
        "typing-extensions": "4.16.0",
        "typing-inspection": "0.4.4"
      }
    }
  },
  "contents": {
    "runtime_venv": "/opt/termini/venv",
    "framework_venvs": "/opt/termini/venvs/{langchain,crewai,autogen}",
    "node_dir": "/opt/termini/node",
    "agent_bin": "/opt/termini/venv/bin/termini-agent",
    "config": "/etc/termini/agent.yaml"
  },
  "first_boot": {
    "preflight_unit": "termini-firstboot-preflight.service",
    "boot_log_path": "/var/log/termini/first-boot.json",
    "network_required": false
  }
}
